{
  "schemaVersion": 1,
  "segment": 0,
  "startSeq": 0,
  "prevSegmentSha256": null,
  "entries": [
    {
      "seq": 0,
      "h": "0c6771c0a8e155fd5d61fcbb292abd7717f5b170c8d7ea77d113019937d01b77",
      "typ": "entitlement-record",
      "kind": "issue",
      "ref": null,
      "ts": "2026-11-12T10:20:00Z"
    },
    {
      "seq": 1,
      "h": "86a2464b74a4fc3e30800c147d7cf3260ec8883940edc06559b39786aabb16e0",
      "typ": "supporter",
      "kind": "issue",
      "ref": null,
      "ts": "2026-11-12T10:21:00Z"
    },
    {
      "seq": 2,
      "h": "63477eaa83011fa9903b527c24eb4eaf28a85d60e6f97f6fc6cf34eb8988739d",
      "typ": "license-status",
      "kind": "issue",
      "ref": null,
      "ts": "2026-11-18T08:05:00Z"
    },
    {
      "seq": 3,
      "h": "aa2dd370dfffeb91545ca6ff511922f0ec81a77045fe80c6296ab6fb173dda11",
      "typ": "supporter",
      "kind": "revoke",
      "ref": "86a2464b74a4fc3e30800c147d7cf3260ec8883940edc06559b39786aabb16e0",
      "ts": "2026-12-03T11:05:00Z"
    },
    {
      "seq": 4,
      "h": "2d1efd001f75c9b1c18903d29d921405f694c232c76f6c34b222d6bd6a62eae2",
      "typ": "ct-checkpoint",
      "kind": "issue",
      "ref": null,
      "ts": "2026-12-31T23:59:00Z"
    }
  ]
}
